{
  "$schema": "./schema.json",
  "version": "2.11.0",
  "generated": "2026-10-12",
  "source": "https://github.com/pacocartones/free-llm-api-hub",
  "note": "Canonical dataset. README tables, badge-freshness.json and the interactive site are all generated from this file — do not hand-edit them. `verified: true` means the core facts (tier, limits, key catch, link) were independently confirmed against the provider's own docs on `last_verified`. `verified: false` means sourced from community tracking and not yet independently re-confirmed here — treat those as indicative. Attribute fields (openai_compatible, modalities, best_for) are progressively backfilled and may be null.",
  "providers": [
    {
      "slug": "google-gemini",
      "name": "Google Gemini API (AI Studio)",
      "category": "ongoing",
      "free_type": "renewing-quota",
      "free_tier": "Gemini 2.5 Flash, 2.5 Flash-Lite, 2.5 Pro (limited), embeddings, TTS models",
      "rate_limits": "Per-model; Google no longer publishes the free-tier numbers in its public docs — they are shown only on the AI Studio rate-limit page after sign-in",
      "notes": "Free-tier prompts/outputs may be used by Google to improve its products outside the UK/CH/EEA/EU. Since the 2026-03-23 terms, only Paid Services may serve API clients to end users in the EEA/CH/UK",
      "best_for": "The only frontier-class model with a genuine free tier",
      "modalities": ["text", "vision", "embeddings", "audio"],
      "models_free": ["gemini-2.5-flash", "gemini-2.5-flash-lite", "gemini-2.5-pro"],
      "expires": null,
      "docs_url": "https://ai.google.dev/gemini-api/docs/rate-limits",
      "phone_required": false,
      "card_required": false,
      "commercial_ok": true,
      "openai_compatible": true,
      "openai_base_url": "https://generativelanguage.googleapis.com/v1beta/openai/",
      "env_key": "GEMINI_API_KEY",
      "is_text_llm": true,
      "model_tier": 3,
      "model_tier_source": {"model":"gemini-2.5-pro","arena_model":"gemini-2.5-pro","match":"exact","rating":1445.6,"ci":[1443.1,1448],"boundary":true,"votes":124834,"snapshot":"2026-10-02","url":"https://huggingface.co/datasets/lmarena-ai/leaderboard-dataset"},
      "verified": true,
      "last_verified": "2026-10-08"
    },
    {
      "slug": "groq",
      "name": "Groq",
      "category": "ongoing",
      "free_type": "renewing-quota",
      "free_tier": "Open-weight models (GPT-OSS, Qwen) plus Whisper, no credit card required",
      "rate_limits": "Free plan examples: openai/gpt-oss-120b, openai/gpt-oss-20b and qwen/qwen3.8-27b: 30 RPM/1K RPD/8K TPM/200K TPD; Whisper models: 20 RPM/2K RPD/7.2K audio seconds/hour and 28.8K/day; limits vary by model",
      "notes": "Limits apply at the organization level, not per API key. Phone verification required at signup",
      "best_for": "Lowest-latency inference for open-weight models",
      "modalities": ["text", "audio"],
      "models_free": ["openai/gpt-oss-120b", "openai/gpt-oss-20b", "qwen/qwen3.8-27b", "whisper-large-v3", "whisper-large-v3-turbo"],
      "expires": null,
      "docs_url": "https://console.groq.com/docs/rate-limits",
      "phone_required": true,
      "card_required": false,
      "commercial_ok": true,
      "openai_compatible": true,
      "openai_base_url": "https://api.groq.com/openai/v1",
      "env_key": "GROQ_API_KEY",
      "is_text_llm": true,
      "model_tier": 3,
      "model_tier_source": {"model":"qwen/qwen3.8-27b","arena_model":"qwen3.8-27b","match":"variant","rating":1437.7,"ci":[1432.3,1443.1],"votes":18462,"snapshot":"2026-10-02","url":"https://huggingface.co/datasets/lmarena-ai/leaderboard-dataset"},
      "free_limits": {"requests_per_minute":30,"requests_per_day":1000,"tokens_per_day":200000,"scope":"free plan, each of openai/gpt-oss-120b, openai/gpt-oss-20b and qwen/qwen3.8-27b; limits vary by model","source":"https://console.groq.com/docs/rate-limits","checked":"2026-10-08"},
      "verified": true,
      "last_verified": "2026-10-08"
    },
    {
      "slug": "openrouter",
      "name": "OpenRouter",
      "category": "ongoing",
      "free_type": "renewing-quota",
      "free_tier": "A rotating set of models with a :free suffix (16 on 2026-10-08; count fluctuates), single API across many providers",
      "rate_limits": "20 req/min; 50 req/day under 10 credits purchased lifetime, 1000 req/day once 10+ credits purchased (one-time, not a subscription)",
      "notes": "ToS (Jul 2026) prohibits reselling API access or building a competing service — platform-wide, not just the free models; per-model terms still apply",
      "best_for": "Widest model selection behind one no-card key",
      "modalities": ["text", "vision"],
      "models_free": ["cohere/north-mini-code:free", "google/gemma-4-26b-a4b-it:free", "google/gemma-4-31b-it:free", "liquid/lfm-2.5-2.6b:free", "nvidia/nemotron-3-nano-omni-30b-a3b-reasoning:free", "poolside/laguna-s-2.1:free"],
      "expires": null,
      "docs_url": "https://openrouter.ai/docs/api-reference/limits",
      "phone_required": false,
      "card_required": false,
      "commercial_ok": true,
      "openai_compatible": true,
      "openai_base_url": "https://openrouter.ai/api/v1",
      "env_key": "OPENROUTER_API_KEY",
      "is_text_llm": true,
      "model_tier": 4,
      "model_tier_source": {"model":"google/gemma-4-31b-it:free","arena_model":"gemma-4-31b","match":"variant","rating":1452.8,"ci":[1445.4,1460.3],"boundary":true,"votes":6133,"snapshot":"2026-10-02","url":"https://huggingface.co/datasets/lmarena-ai/leaderboard-dataset"},
      "free_limits": {"requests_per_minute":20,"requests_per_day":50,"scope":"free models, accounts with under 10 credits purchased lifetime (1,000 requests/day once 10+ credits are purchased); table not readable in a plain fetch, figures are those of the entry's own verification","source":"https://openrouter.ai/docs/api-reference/limits","checked":"2026-10-08"},
      "verified": true,
      "last_verified": "2026-10-08"
    },
    {
      "slug": "cloudflare-workers-ai",
      "name": "Cloudflare Workers AI",
      "category": "ongoing",
      "free_type": "renewing-quota",
      "free_tier": "10,000 Neurons/day, all account plans",
      "rate_limits": "10,000 Neurons/day (free allocation). Per-task request limits: text generation 300 requests/min (models that require Workers Paid: 20 requests/min per model); text embeddings 3,000/min; speech recognition, text-to-image, translation, image-to-text 720/min",
      "notes": "Resets daily at 00:00 UTC; overage on a Workers Paid plan bills at $0.011/1,000 Neurons. A few models (e.g. Kimi K2.6/K2.7-code, GLM-5.2) now require a Workers Paid plan",
      "best_for": "Highest free daily volume for a real side project",
      "modalities": ["text", "embeddings", "image", "audio"],
      "models_free": ["@cf/meta/llama-3.3-70b-instruct-fp8-fast", "@cf/meta/llama-3.1-8b-instruct", "@cf/mistralai/mistral-small-3.1-24b-instruct", "@cf/qwen/qwen2.5-coder-32b-instruct", "@cf/deepseek-ai/deepseek-r1-distill-qwen-32b", "@cf/google/gemma-3-12b-it"],
      "expires": null,
      "docs_url": "https://developers.cloudflare.com/workers-ai/platform/pricing/",
      "phone_required": false,
      "card_required": false,
      "commercial_ok": true,
      "openai_compatible": true,
      "openai_base_url": "https://api.cloudflare.com/client/v4/accounts/{account_id}/ai/v1",
      "env_key": "CLOUDFLARE_API_TOKEN",
      "is_text_llm": true,
      "model_tier": 2,
      "model_tier_source": {"model":"@cf/google/gemma-3-12b-it","arena_model":"gemma-3-12b-it","match":"exact","rating":1341.8,"ci":[1332.2,1351.3],"boundary":true,"votes":3829,"snapshot":"2026-10-02","url":"https://huggingface.co/datasets/lmarena-ai/leaderboard-dataset"},
      "free_limits": {"requests_per_minute":300,"scope":"text generation; models that require Workers Paid: 20 requests/minute per model. The daily allowance is 10,000 Neurons, a unit that is not requests or tokens","source":"https://developers.cloudflare.com/workers-ai/platform/limits/","checked":"2026-10-08"},
      "verified": true,
      "last_verified": "2026-10-08"
    },
    {
      "slug": "cohere",
      "name": "Cohere",
      "category": "ongoing",
      "free_type": "renewing-quota",
      "free_tier": "Trial (evaluation) API keys covering chat, embed and rerank",
      "rate_limits": "1,000 API calls/month total; 20 req/min chat; 2,000 inputs/min embed; 10 req/min rerank",
      "notes": "Explicitly for evaluation only — Cohere's terms prohibit production/commercial use on a trial key",
      "best_for": "Free embeddings and rerank for RAG prototypes",
      "modalities": ["text", "embeddings", "rerank"],
      "models_free": ["command-a-03-2025", "command-r-plus-08-2024", "command-r-08-2024", "command-r7b-12-2024", "embed-v4.0", "rerank-v3.5"],
      "expires": null,
      "docs_url": "https://docs.cohere.com/docs/rate-limits",
      "phone_required": false,
      "card_required": false,
      "commercial_ok": false,
      "openai_compatible": true,
      "openai_base_url": "https://api.cohere.ai/compatibility/v1",
      "env_key": "COHERE_API_KEY",
      "is_text_llm": true,
      "model_tier": 2,
      "model_tier_source": {"model":"command-a-03-2025","arena_model":"command-a-03-2025","match":"exact","rating":1353.7,"ci":[1350.2,1357.2],"votes":55467,"snapshot":"2026-10-02","url":"https://huggingface.co/datasets/lmarena-ai/leaderboard-dataset"},
      "free_limits": {"requests_per_minute":20,"requests_per_month":1000,"scope":"trial key, chat endpoint; 1,000 API calls per month in total","source":"https://docs.cohere.com/docs/rate-limits","checked":"2026-10-08"},
      "verified": true,
      "last_verified": "2026-10-08"
    },
    {
      "slug": "cerebras",
      "name": "Cerebras",
      "category": "trial",
      "free_type": "trial-credit",
      "free_tier": "$5 in free credits for new accounts, usable across all public models",